{
  "schemaVersion": "1",
  "status": "complete",
  "input": {
    "uri": "file:///inputs/sample.epub",
    "kind": "epub",
    "contentDigest": "sha256:0000000000000000000000000000000000000000000000000000000000000000"
  },
  "events": [
    {"step": "epub.text.content.analyze", "status": "completed", "message": "detector run (read-only): 6 blocks, 0 review_required, status pass"}
  ]
}
