{
  "schemaVersion": "1",
  "status": "complete",
  "input": {
    "uri": "file:///inputs/sample.epub",
    "kind": "epub",
    "contentDigest": "sha256:0000000000000000000000000000000000000000000000000000000000000000"
  },
  "output": {
    "uri": "file:///outputs/sample.epub",
    "kind": "epub",
    "contentDigest": "sha256:0000000000000000000000000000000000000000000000000000000000000000"
  },
  "events": [
    {"step": "redline", "status": "completed", "message": "All requested red-line checks passed."}
  ]
}
